,date,title,text,company
16,"September 16, 2022",Designating Large Platforms Under The DMA And The DSA: Comparing Apples and Oranges?,"
By: Konstantina Bania (The Platform Law Blog)
The Digital Markets Act (“DMA”) and the Digital Services Act (“DSA”) will soon start to apply. Broadly speaking, both instruments have the same objective, which is to address concerns arising from the increasing reliance on online platforms. However, despite being presented as parts of the same “package”, the DSA and the DMA do not have many similarities because they target different problems. The DMA imposes obligations to protect businesses and consumers against unfair platform practices. The DSA imposes obligations for a “safe, predictable and trusted online environment” through a framework for conditional liability exemptions and rules on due diligence obligations. In other words, the DMA primarily seeks to improve market conditions whereas the DSA, which is essentially content regulation, attempts to strike a balance between restricting the dissemination of illegal content online and the effective exercise of fundamental freedoms (e.g., freedom of speech, freedom to conduct business). The two instruments are also based on a different logic. The DMA only applies to “gatekeeper” platforms, that is, platforms that act as gateways between businesses and consumers. The DSA sets a baseline for all intermediaries and adopts a “graduated” approach whereby the rules become stricter depending on the category to which an intermediary belongs (intermediaries; intermediaries that are hosting service providers; hosting service providers that qualify as online platforms; and very large online platforms). 
However, the DMA and the DSA have certain similarities with respect to the regulation of the large service providers that fall under their scope. The entire text of the DMA and Section 4 of the DSA are based on the premise that “gatekeeper platforms” and “very large online platforms” (or “VLOPs”) pose unique challenges that can only be addressed through rules that target them specifically. Both instruments are based on user thresholds to determine the size (and, by extension, the power) of platforms that should be subject to such rules and they both envisage a designation process. Such similarities may be the reason for the misunderstanding that platforms that fall under the scope of the DSA will certainly abide by the DMA. This may not necessarily be the case because the definitional criteria, the designation process, and the methodology to calculate the size of the platform concerned are different. This blog post discusses this issue, detangling the conditions and the process pursuant to which a platform may qualify as a gatekeeper or as a VLOP under the DMA and the DSA respectively…
CONTINUE READING…
",Apple
17,"September 11, 2022",Apple Faces Mexican Competition Investigation For App Store Fees,"


Apple may face yet another competition probe from regulators in Mexico, after a former telecommunications chief filed a complaint against tech giants on Friday.
The complaint, brought to Mexico’s telecoms regulator IFT on Thursday, has Mony de Swaan Addati accusing Apple and Google of “completely inhibiting competition, by abusing their App Store monopoly to force the use of their own payment services for in-app payments.
The complaint, seen by Reuters, claims the Google Play Store and Apple’s App Store charge between 15% and 20% commission, which in turn forces price inflation.Addati was previously the head of the telecommunications federation that existed before being replaced by the IFT.
He claims Mexico’s competition regulator declined to open an investigation into the matter, therefore prompting a turn toward the IFT over the matter.
“I have full confidence that (the IFT) will investigate and exercise its powers, in line with international best practices, so that these companies stop abusing their market power to the detriment of developers and consumers,” said Addati.
Want more news? Subscribe to CPI’s free daily newsletter for more headlines and updates on antitrust developments around the world.
",Apple
18,"September 7, 2022",Spotify Wants The EU To ‘Accelerate’ Apple Antitrust Case,"


The founder of music streaming app Spotify has used a rare visit to Brussels to apply personal pressure on the European Commission for a case against Apple’s competition practices to be sped up.
In an interview with the Financial Times, Swedish billionaire Daniel Ek said he spoke with commissioner Margrethe Vestager about what he sees as Apple’s “anti-competitive conduct”.
“It’s a picture of a company that keeps zigging and zagging to avoid doing anything”, he said of the iPhone maker. Regulators in Japan, the Netherlands and South Korea that “have come down pretty hard on” Apple, Ek said, and he urged the commission to do the same.
Spotify filed a complaint before European regulators in 2019 claiming that Apple was taking a 30 per cent cut of its subscription fees for featuring it in the App Store and denying the streaming service the right to tell its users that other ways of upgrading were available. The European Commission only formally charged Apple with breaking EU law earlier this year.
Want more news? Subscribe to CPI’s free daily newsletter for more headlines and updates on antitrust developments around the world.
",Apple
19,"September 5, 2022","Apple Chief Privacy Officer Departs For Gibson, Dunn & Crutcher","
Chief Privacy Officer Jane Horvath will be leaving the company soon to work at a law firm, Bloomberg News reported citing people familiar with the matter.
Horvath, who joined Apple in 2011, is taking a job at Gibson, Dunn & Crutcher, the report said.
The iPhone maker’s top privacy executive, who is also a lawyer, had previously served in key privacy roles at Google the US Department of Justice, as per her LinkedIn profile.
Horvath was hired to formalize privacy practices after the 2011 “locationgate” scandal, in which iPhones were found to be gathering information about users’ whereabouts.
The reported move by Horvath also comes after Apple upended the digital ad industry by introducing new iPhone privacy controls last year, which hurt the ability for firms like Meta and Snap to target and measure ads on their apps.
",Apple
